Country Name,Country Code,Series Name,Series Code,2000 [YR2000],2001 [YR2001],2002 [YR2002],2003 [YR2003],2004 [YR2004],2005 [YR2005],2006 [YR2006],2014 [YR2014],2015 [YR2015],2016 [YR2016],2017 [YR2017],2018 [YR2018],2019 [YR2019],2020 [YR2020],2021 [YR2021],2022 [YR2022]
World,WLD,Access to clean fuels and technologies for cooking (% of population),EG.CFT.ACCS.ZS,49.386911202714,49.8015565650654,50.3645029255777,50.8127349472587,51.5619092301428,52.3015995271876,53.0287739775725,61.6980981442135,62.9763459113715,64.2084464173381,65.6789211457952,67.0510549892321,68.3587758766613,69.5701114809215,..,..
World,WLD,"Access to clean fuels and technologies for cooking, rural (% of rural population)",EG.CFT.ACCS.RU.ZS,24.3523850006051,24.5477056910194,24.6979554495183,25.005293157385,25.3518424688154,25.9044956403577,26.4132013446689,35.8654582173865,37.6866461365411,39.6316898239273,41.6962810002266,44.0341313499996,46.156712802845,48.4595119926932,..,..
World,WLD,"Access to clean fuels and technologies for cooking, urban (% of urban population)",EG.CFT.ACCS.UR.ZS,76.1588443512886,76.3893049278698,76.6518095370916,76.9679406681609,77.3567549600306,77.730361899899,78.2346983454508,83.4844522919722,84.0648312379326,84.6501468741832,85.0985359348072,85.6108083503657,86.021572757083,86.3919803141058,..,..
World,WLD,Access to electricity (% of population),EG.ELC.ACCS.ZS,78.1798986419251,77.8317161074376,79.2821473286737,79.8711372989495,80.0792478091506,80.5710438126695,81.2793037809783,85.5476862244181,86.5258006896778,87.6062268251272,88.504096925462,89.4789021234741,89.9263306890669,90.435576612831,..,..
World,WLD,"Access to electricity, rural (% of rural population)",EG.ELC.ACCS.RU.ZS,66.1790409778153,66.207592779247,68.6156546072998,67.3450509026999,66.9151201015682,67.8197682703437,68.6961267273767,74.5764073863398,75.6322264932628,77.9395207331354,81.288937787253,83.1083176039613,84.13856429263,82.5443798777831,..,..
World,WLD,"Access to electricity, urban (% of urban population)",EG.ELC.ACCS.UR.ZS,94.9383197309416,94.6499190070599,94.969002885813,95.1350540490652,95.1076128088269,95.2716956655281,95.5016117125075,96.3447485645493,96.2524228904449,96.7442933659494,97.2629707759984,97.3941115101058,97.6176052335493,97.2352398533877,..,..
World,WLD,Account ownership at a financial institution or with a mobile-money-service provider (% of population ages 15+),FX.OWN.TOTL.ZS,..,..,..,..,..,..,..,61.92,..,..,68.5,..,..,..,76.2,..
World,WLD,"Account ownership at a financial institution or with a mobile-money-service provider, female (% of population ages 15+)",FX.OWN.TOTL.FE.ZS,..,..,..,..,..,..,..,58.4,..,..,64.85,..,..,..,73.99,..
World,WLD,"Account ownership at a financial institution or with a mobile-money-service provider, male (% of population ages 15+)",FX.OWN.TOTL.MA.ZS,..,..,..,..,..,..,..,65.49,..,..,72.24,..,..,..,78.35,..
World,WLD,"Account ownership at a financial institution or with a mobile-money-service provider, older adults (% of population ages 25+)",FX.OWN.TOTL.OL.ZS,..,..,..,..,..,..,..,66.12,..,..,71.91,..,..,..,79.07,..
World,WLD,"Account ownership at a financial institution or with a mobile-money-service provider, poorest 40% (% of population ages 15+)",FX.OWN.TOTL.40.ZS,..,..,..,..,..,..,..,54.62,..,..,60.89,..,..,..,71.91,..
World,WLD,"Account ownership at a financial institution or with a mobile-money-service provider, primary education or less (% of population ages 15+)",FX.OWN.TOTL.PL.ZS,..,..,..,..,..,..,..,48.4,..,..,56.34,..,..,..,66.01,..
World,WLD,"Account ownership at a financial institution or with a mobile-money-service provider, richest 60% (% of population ages 15+)",FX.OWN.TOTL.60.ZS,..,..,..,..,..,..,..,66.86,..,..,73.73,..,..,..,79.05,..
World,WLD,"Account ownership at a financial institution or with a mobile-money-service provider, secondary education or more (% of population ages 15+)",FX.OWN.TOTL.SO.ZS,..,..,..,..,..,..,..,73.22,..,..,78.6,..,..,..,84.62,..
World,WLD,"Account ownership at a financial institution or with a mobile-money-service provider, young adults (% of population ages 15-24)",FX.OWN.TOTL.YG.ZS,..,..,..,..,..,..,..,46.9,..,..,56.3,..,..,..,65.52,..
World,WLD,Adequacy of social insurance programs (% of total welfare of beneficiary households),per_si_allsi.adq_pop_tot,..,..,..,..,..,..,..,..,..,..,..,..,..,..,..,..
World,WLD,Adequacy of social protection and labor programs (% of total welfare of beneficiary households),per_allsp.adq_pop_tot,..,..,..,..,..,..,..,..,..,..,..,..,..,..,..,..
World,WLD,Adequacy of social safety net programs (% of total welfare of beneficiary households),per_sa_allsa.adq_pop_tot,..,..,..,..,..,..,..,..,..,..,..,..,..,..,..,..
World,WLD,Adequacy of unemployment benefits and ALMP (% of total welfare of beneficiary households),per_lm_alllm.adq_pop_tot,..,..,..,..,..,..,..,..,..,..,..,..,..,..,..,..
World,WLD,"Adjusted net enrollment rate, primary (% of primary school age children)",SE.PRM.TENR,..,..,..,..,..,..,..,90.44798,90.30999,90.5136,90.48209,90.45493,..,..,..,..
World,WLD,"Adjusted net enrollment rate, primary, female (% of primary school age children)",SE.PRM.TENR.FE,..,..,..,..,..,..,..,89.76395,89.5167,89.63329,89.56732,89.45854,..,..,..,..
World,WLD,"Adjusted net enrollment rate, primary, male (% of primary school age children)",SE.PRM.TENR.MA,..,..,..,..,..,..,..,91.19433,91.15254,91.41351,91.40409,91.46353,..,..,..,..
World,WLD,Adjusted net national income (annual % growth),NY.ADJ.NNTY.KD.ZG,3.57730773260701,1.84290862736327,4.08356279199809,1.34112699362142,5.50188485032177,3.84830321448599,5.17645177860425,3.26534551681496,3.31440486873376,2.5977424305121,3.61177142578708,2.30867581127076,2.50513686608495,-4.26269672960188,..,..
World,WLD,Adjusted net national income (constant 2015 US$),NY.ADJ.NNTY.KD,44437124597585,45256060200546.1,47104119836019.9,47735845902248.5,50362217176117.3,52300307998592.2,55007608222200.8,59768868650055.5,61749850942580.1,63353953021293.4,65642152993623.1,67157617501784.2,68840007736205.7,65905566977776.8,..,..
World,WLD,Adjusted net national income (current US$),NY.ADJ.NNTY.CD,28052166386128.1,27922357816076.6,28956739979765.5,32408954619823.3,36549981826600,39445751259769.8,42901257046696.8,65071071538938.7,61631628380470.5,62596688007477.5,66692896504048.9,70284831261590.6,71213354902445.1,68580436251713.7,76892463673445,..
World,WLD,Adjusted net national income per capita (annual % growth),NY.ADJ.NNTY.PC.KD.ZG,2.19431033850302,0.501376641693412,2.7346345530199,0.0517878067899176,4.17410396353537,2.55268197190377,3.87082337481419,2.0189063877483,2.09495738222923,1.40600931073745,2.43288729132787,1.1921043471927,1.43403007622773,-5.2211687028158,..,..
World,WLD,Adjusted net national income per capita (constant 2015 US$),NY.ADJ.NNTY.PC.KD,7232.22506189034,7268.48574902535,7467.25227179953,7471.11939797856,7782.97168889005,7981.64620407072,8290.60163103286,8167.92581567487,8339.04038052536,8456.2880647017,8662.0200223459,8765.28033958699,8890.97709592234,8426.76418241553,..,..
World,WLD,Adjusted net national income per capita (current US$),NY.ADJ.NNTY.PC.CD,4565.54249662453,4484.55431086975,4590.4112665845,5072.31337272612,5648.4303062172,6019.88865567931,6465.96431184504,8892.51707587792,8323.07495381951,8355.21069237112,8800.67423934793,9173.43813770705,9197.50488389946,8768.77614929316,9747.52535450025,..
World,WLD,"Adjusted net savings, excluding particulate emission damage (% of GNI)",NY.ADJ.SVNX.GN.ZS,10.1319861861195,9.2883038759397,8.84859585975685,8.87950605115609,9.69929492497294,9.86942253269727,10.9981843680685,10.6918313072347,10.7273446521197,10.3121842870892,11.086789803062,10.83034447757,10.5340929567926,9.54077852011365,9.8263178493087,..
World,WLD,"Adjusted net savings, excluding particulate emission damage (current US$)",NY.ADJ.SVNX.CD,..,..,..,..,..,..,..,..,..,..,..,..,..,..,..,..
World,WLD,"Adjusted net savings, including particulate emission damage (% of GNI)",NY.ADJ.SVNG.GN.ZS,9.87686277003169,9.03846204267716,8.6034201662385,8.64526027265243,9.47347596860348,9.64125532131101,10.7669042055508,10.4430719870104,10.4735886460938,10.0638297374745,10.8428937696429,10.5907060531755,10.2937634912764,9.28885375443439,9.58372053632605,..
World,WLD,"Adjusted net savings, including particulate emission damage (current US$)",NY.ADJ.SVNG.CD,..,..,..,..,..,..,..,..,..,..,..,..,..,..,..,..
World,WLD,Adjusted savings: carbon dioxide damage (% of GNI),NY.ADJ.DCO2.GN.ZS,1.28061398847662,1.3687298930452,1.39184979385877,1.3556891587256,1.31919190163232,1.33181750753955,1.33079101456842,1.39194892676542,1.51452732788463,1.54212644221687,1.52904991989789,1.54468664418884,1.5883875012491,1.61061549256563,1.55287600193328,..
World,WLD,Adjusted savings: carbon dioxide damage (current US$),NY.ADJ.DCO2.CD,..,..,..,..,..,..,..,..,..,..,..,..,..,..,..,..
World,WLD,Adjusted savings: consumption of fixed capital (% of GNI),NY.ADJ.DKAP.GN.ZS,15.6563359318527,15.8051072584403,15.8619391591647,15.8170493753825,15.627068437214,15.5316822250737,15.4055651390212,17.1617603526369,17.3751361015691,17.4218600952167,17.2976164456744,17.5478595434404,17.797244456988,18.8990118450501,18.7499679506815,..
World,WLD,Adjusted savings: consumption of fixed capital (current US$),NY.ADJ.DKAP.CD,..,..,..,..,..,..,..,..,..,..,..,..,..,..,..,..
World,WLD,Adjusted savings: education expenditure (% of GNI),NY.ADJ.AEDU.GN.ZS,4.03788541683605,4.16159196696251,4.19717020944476,4.29358104870551,4.18493433218859,4.10735856816009,4.1428666668339,4.27573792445013,3.9678441841372,3.91421337209259,3.94720247427054,3.86364884003613,3.86519662884317,3.83313976161423,3.79964897315212,..
World,WLD,Adjusted savings: education expenditure (current US$),NY.ADJ.AEDU.CD,..,..,..,..,..,..,..,..,..,..,..,..,..,..,..,..
World,WLD,Adjusted savings: energy depletion (% of GNI),NY.ADJ.DNGY.GN.ZS,1.09967980092788,0.912716132901462,0.815376473551459,0.971334322590793,1.19466882859,1.56800982849079,1.56057800147792,1.26547743172875,0.636823440089752,0.530751257192832,0.69187040795685,0.98381213816735,0.841745745640762,0.469411127762548,0.994237295145419,..
World,WLD,Adjusted savings: energy depletion (current US$),NY.ADJ.DNGY.CD,..,..,..,..,..,..,..,..,..,..,..,..,..,..,..,..
World,WLD,Adjusted savings: gross savings (% of GNI),NY.ADJ.ICTR.GN.ZS,24.2218331759423,23.2885526718717,22.8025567980576,22.8279736922367,23.7642566693139,24.343804926663,25.404562359568,26.4541479645198,26.4517285027461,26.0737217584628,26.8471030259704,27.2216484682022,27.059559742312,26.8840414389141,27.795944185053,..
World,WLD,Adjusted savings: mineral depletion (% of GNI),NY.ADJ.DMIN.GN.ZS,0.0395743319634621,0.0300942456158641,0.0331660569881045,0.0342084801213021,0.0621399334701363,0.101629720877396,0.202574981634064,0.150453439092593,0.0953181704552204,0.1085869246369,0.120075232513764,0.128547988059826,0.113680484601366,0.138529041240275,0.416824948489106,..
World,WLD,Adjusted savings: mineral depletion (current US$),NY.ADJ.DMIN.CD,..,..,..,..,..,..,..,..,..,..,..,..,..,..,..,..
World,WLD,Adjusted savings: natural resources depletion (% of GNI),NY.ADJ.DRES.GN.ZS,1.20721058345654,1.00101305823791,0.908232324574582,1.08167108253743,1.31702718583684,1.73518685913604,1.82807744443723,1.49823735973354,0.810326441925731,0.719130498778104,0.89000126053998,1.17786698519236,1.03476836682153,0.687321366542261,1.51566961442211,..
World,WLD,Adjusted savings: net forest depletion (% of GNI),NY.ADJ.DFOR.GN.ZS,0.0515283534382195,0.0451932328917036,0.0487996641825561,0.0637673529659138,0.0468269756231035,0.048601680144403,0.0497355216317548,0.0684144315116477,0.0704229947649864,0.0724261242029032,0.0689036911361213,0.0500465168119212,0.0496052258833416,0.0588351737961442,0.0553691126470345,..
World,WLD,Adjusted savings: net forest depletion (current US$),NY.ADJ.DFOR.CD,..,..,..,..,..,..,..,..,..,..,..,..,..,..,..,..
World,WLD,Adjusted savings: net national savings (% of GNI),NY.ADJ.NNAT.GN.ZS,8.56549724408964,7.48344541343142,6.94061763889298,7.01092431685419,8.13718823209991,8.81212270158931,9.99899722054679,9.29238761188298,9.07659240117708,8.65186166324612,9.54948658029605,9.67378892476177,9.26231528532402,7.98502959386403,9.04597623437142,..
World,WLD,Adjusted savings: net national savings (current US$),NY.ADJ.NNAT.CD,..,..,..,..,..,..,..,..,..,..,..,..,..,..,..,..
World,WLD,Adjusted savings: particulate emission damage (% of GNI),NY.ADJ.DPEM.GN.ZS,0.255123416087812,0.249841833262537,0.245175693518346,0.234245778503666,0.225818956369463,0.228167211386266,0.231280162517715,0.248759320224304,0.253756006025901,0.248354549614687,0.243896033419102,0.239638424394478,0.240329465516176,0.251924765679266,0.242597312982653,..
World,WLD,Adjusted savings: particulate emission damage (current US$),NY.ADJ.DPEM.CD,..,..,..,..,..,..,..,..,..,..,..,..,..,..,..,..
World,WLD,"Adolescent fertility rate (births per 1,000 women ages 15-19)",SP.ADO.TFRT,64.4368227260554,63.8253840747145,61.9076141774962,60.0702587386233,57.0564483539437,53.3863285175373,51.881393336138,50.8086898582736,47.1912425124578,45.6600244147707,44.9179549442591,44.0708080390929,43.3728490796658,42.7458193979032,..,..
World,WLD,Adolescents out of school (% of lower secondary school age),SE.SEC.UNER.LO.ZS,..,..,..,..,..,..,..,..,..,..,..,..,..,..,..,..
World,WLD,"Adolescents out of school, female (% of female lower secondary school age)",SE.SEC.UNER.LO.FE.ZS,..,..,..,..,..,..,..,..,..,..,..,..,..,..,..,..
World,WLD,"Adolescents out of school, male (% of male lower secondary school age)",SE.SEC.UNER.LO.MA.ZS,..,..,..,..,..,..,..,..,..,..,..,..,..,..,..,..
World,WLD,Adults (ages 15+) and children (ages 0-14) newly infected with HIV,SH.HIV.INCD.TL,2900000,2800000,2700000,2600000,2600000,2500000,2400000,1900000,1900000,1800000,1700000,1700000,1600000,1500000,1500000,..
World,WLD,Adults (ages 15-49) newly infected with HIV,SH.HIV.INCD,2200000,2100000,2000000,2000000,1900000,1900000,1900000,1600000,1500000,1500000,1400000,1400000,1300000,1300000,1200000,..
World,WLD,Age dependency ratio (% of working-age population),SP.POP.DPND,60.4460079488408,59.7196306393343,58.989034348677,58.2884796127468,57.604668780696,56.9239494653066,56.3343971287293,54.7837360683891,54.8758245332187,54.977223824396,55.113673455434,55.2355061886067,55.3222575554381,55.3545570196875,55.2898025634586,..
World,WLD,"Age dependency ratio, old (% of working-age population)",SP.POP.DPND.OL,10.9488297035898,11.0371572913485,11.1299798259045,11.2194610879101,11.3008711008493,11.3772363054603,11.4560542555633,12.5028363256934,12.791940966831,13.1049930733128,13.4456353479344,13.8019112140831,14.1683390832829,14.5279790585396,14.8210662608189,..
World,WLD,"Age dependency ratio, young (% of working-age population)",SP.POP.DPND.YG,48.050477654792,47.2175268931404,46.3547619563389,45.5215745725467,44.7164357287324,43.9134893593983,43.2135609580577,40.7532386785389,40.6026643710299,40.4419970671689,40.2982349086948,40.1215435288405,39.8925673152805,39.612692659072,39.2915011052361,..
World,WLD,Agricultural irrigated land (% of total agricultural land),AG.LND.IRIG.AG.ZS,..,..,..,..,..,..,..,..,..,..,..,..,..,..,..,..
World,WLD,Agricultural land (% of land area),AG.LND.AGRI.ZS,37.5515716382018,37.568890667337,37.4798191569315,37.3570409135281,37.0131145073422,37.0638041570258,37.057093884862,36.5509717780437,36.3606110051761,36.3363929546631,36.6166649290419,36.4987362570507,36.5113073576613,36.458840823954,..,..
World,WLD,Agricultural land (sq. km),AG.LND.AGRI.K2,48709741.73,48731763.742,48615402.999,48458808.543,48066913.708,48133757.712,48124627.617,47506401.292,47260304.816,47232387.379,47594035.118,47441011.016,47457328.403,47388929.172,..,..
World,WLD,"Agricultural machinery, tractors",AG.AGR.TRAC.NO,25068731.5,..,23630922,..,..,..,..,..,..,..,..,..,..,..,..,..
World,WLD,"Agricultural machinery, tractors per 100 sq. km of arable land",AG.LND.TRAC.ZS,..,..,..,..,..,..,..,..,..,..,..,..,..,..,..,..
World,WLD,Agricultural methane emissions (% of total),EN.ATM.METH.AG.ZS,46.2696731404566,46.0951103424793,46.1914905920022,45.5257290700873,45.71202338263,45.7032890323979,45.3826764483452,..,..,..,..,..,..,..,..,..
World,WLD,Agricultural methane emissions (thousand metric tons of CO2 equivalent),EN.ATM.METH.AG.KT.CE,3179838,3176128,3196815,3195868,3249780,3278508,3307323,3418055,3435258,3460148,3497773,3499338,3492335,..,..,..
World,WLD,Agricultural nitrous oxide emissions (% of total),EN.ATM.NOXE.AG.ZS,77.1761568139649,77.4317235754645,77.7157951627776,77.3267321449017,77.481591873844,77.4062894600384,77.5437834740449,..,..,..,..,..,..,..,..,..
World,WLD,Agricultural nitrous oxide emissions (thousand metric tons of CO2 equivalent),EN.ATM.NOXE.AG.KT.CE,1913662,1928189,1966915,1962241,2021479,2028771,2057808,2237840,2246839,2268412,2318188,2303674,2302272,..,..,..
World,WLD,Agricultural raw materials exports (% of merchandise exports),TX.VAL.AGRI.ZS.UN,1.80967816610202,1.68241263521463,1.68670279737183,1.68916846078301,1.64142418325611,1.55491365146077,1.50600430246671,1.45731458481964,1.47098646446806,1.47941989341181,1.45478882283509,1.43115752787762,1.34844280603649,1.35846673596266,1.40371732615076,1.25995617245946
World,WLD,Agricultural raw materials imports (% of merchandise imports),TM.VAL.AGRI.ZS.UN,2.25667894525221,2.16480217682738,2.07595035690971,1.99342874790012,1.92683485977964,1.78666932886777,1.71400418897507,1.51365844880459,1.55593286498121,1.5413588332848,1.51979006282335,1.47443998615834,1.37987333960038,1.34720663292202,1.4013196794324,1.33946564933941
World,WLD,"Agriculture, forestry, and fishing, value added (% of GDP)",NV.AGR.TOTL.ZS,3.38336842009687,3.369631087033,3.32985567737195,3.31830562831908,3.35813070911073,3.23716768926478,3.21786292544549,4.14185033453574,4.2262744816791,4.18138527160417,4.14809737907177,3.95438855428325,4.00851139984413,4.35180000551078,4.30392395694161,..
World,WLD,"Agriculture, forestry, and fishing, value added (annual % growth)",NV.AGR.TOTL.KD.ZG,3.06056718547518,1.88114672827513,1.82038199368489,2.85412422627478,4.2698780899152,3.85117346582004,2.82508986856588,2.82393309647162,2.52717008768198,2.26404818811908,3.66106152489705,2.2522269837209,2.80308867791217,2.66776051213932,2.01457206790971,..
World,WLD,"Agriculture, forestry, and fishing, value added (constant 2015 US$)",NV.AGR.TOTL.KD,2088960046421.1,2128256449989.33,2166998847184.37,2228847686264.95,2324016765278.36,2413518682283.97,2481702754053.12,3099258611808.73,3177582148386.27,3249524139442.81,3368491217454.19,3444357285597.96,3540905674697.4,3635368558059.08,3708605677595.31,..
World,WLD,"Agriculture, forestry, and fishing, value added (constant LCU)",NV.AGR.TOTL.KN,..,..,..,..,..,..,..,..,..,..,..,..,..,..,..,..
World,WLD,"Agriculture, forestry, and fishing, value added (current LCU)",NV.AGR.TOTL.CN,..,..,..,..,..,..,..,..,..,..,..,..,..,..,..,..
World,WLD,"Agriculture, forestry, and fishing, value added (current US$)",NV.AGR.TOTL.CD,1144916426499.52,1133000515765.36,1162714768477.38,1299190318036.96,1481737283311.86,1546858513190.6,1666212726361.71,3302406475792.09,3177582148386.27,3197478743327.29,3376945268127.03,3419239521152.13,3513630639591.92,3704092744840.79,4154467009114.96,..
World,WLD,"Agriculture, forestry, and fishing, value added per worker (constant 2015 US$)",NV.AGR.EMPL.KD,1976.96008465472,2008.93529181546,2025.37073279713,2076.08375275319,2190.35747242639,2292.23832665862,2387.19248537701,3352.91496454016,3479.15056473708,3591.46688591838,3743.44678135989,3868.95960838881,4035.29262619856,..,..,..
World,WLD,"Air transport, freight (million ton-km)",IS.AIR.GOOD.MT.K1,118257.211,110860.835000095,117506.673,124203.199,139032.94,141483.603,148937.604,185517.109461419,188363.416312345,195588.275094034,213628.647172063,222156.700779335,219524.447845005,182526.184876547,219227.32846961,..
World,WLD,"Air transport, passengers carried",IS.AIR.PSGR,1674064712,1655230214,1627404873,1665309283,1888695284,1969590799,2072413898,3285080769.47589,3525115153,3760774350,4025616011.77031,4293921426.12931,4455690101.02828,1771894087.0245,2279974770.123,..
World,WLD,"Air transport, registered carrier departures worldwide",IS.AIR.DPRT,22008658,22264220,20817389,21282617,23752616,24215712,24829383,33026724.9790769,34030586,35337714,36299460.058,37405640.2483859,38082933.0101284,20098778.5634,24054588.846,..
World,WLD,Alternative and nuclear energy (% of total energy use),EG.USE.COMM.CL.ZS,9.05132131531469,9.05573819203332,9.00932518227275,8.69701464411251,8.70272783553262,8.62864321586974,8.56377401402962,8.13473848426969,13.3540827840592,..,..,..,..,..,..,..
World,WLD,"Annual freshwater withdrawals, agriculture (% of total freshwater withdrawal)",ER.H2O.FWAG.ZS,..,..,..,..,..,..,..,71.2269666558564,71.5773423167505,71.4573587715315,71.3657220781535,71.2046210361845,70.9980803970268,71.3078971509034,..,..
World,WLD,"Annual freshwater withdrawals, domestic (% of total freshwater withdrawal)",ER.H2O.FWDM.ZS,..,..,..,..,..,..,..,11.8106362229742,11.9374920088982,12.3839021444452,12.4350270502653,12.5701742156614,12.8800229487365,13.0833341227032,..,..
World,WLD,"Annual freshwater withdrawals, industry (% of total freshwater withdrawal)",ER.H2O.FWIN.ZS,..,..,..,..,..,..,..,16.9642484476448,16.465428202835,16.1946087706022,16.2047016314934,16.1727162499844,15.8207031534156,15.3692707841393,..,..
World,WLD,"Annual freshwater withdrawals, total (% of internal resources)",ER.H2O.FWTL.ZS,..,..,..,..,..,..,..,8.99785000063423,9.00101020530396,9.0970863516049,9.16045748297895,9.13786420037912,9.16789990252773,9.10951097722045,..,..
World,WLD,"Annual freshwater withdrawals, total (billion cubic meters)",ER.H2O.FWTL.K3,..,..,..,..,..,..,..,3847.6763231956,3849.047770826,3890.158287,3917.306368533,3907.6470903258,3920.4882169713,3895.525271845,..,..
World,WLD,"Annualized average growth rate in per capita real survey mean consumption or income, bottom 40% of population (%)",SI.SPR.PC40.ZG,..,..,..,..,..,..,..,..,..,..,..,..,..,..,..,..
World,WLD,"Annualized average growth rate in per capita real survey mean consumption or income, total population (%)",SI.SPR.PCAP.ZG,..,..,..,..,..,..,..,..,..,..,..,..,..,..,..,..
World,WLD,Antiretroviral therapy coverage (% of people living with HIV),SH.HIV.ARTC.ZS,2,3,3,4,5,7,10,45,50,55,60,64,68,72,75,..
World,WLD,Antiretroviral therapy coverage for PMTCT (% of pregnant women living with HIV),SH.HIV.PMTC.ZS,1,1,3,5,9,17,26,79,81,79,80,81,83,81,81,..
World,WLD,Aquaculture production (metric tons),ER.FSH.AQUA.MT,43012663.75,45557275.72,48672234.76,51533393.12,55811023.1,59155618.71,62950442.12,99634674.38,104007703.18,108221212.67,112240372.92,115924362.73,119808719.94,122711691.07,126035146.07,..
World,WLD,Arable land (% of land area),AG.LND.ARBL.ZS,10.4972633112798,10.4811061595051,10.4553774092573,10.5011382558294,10.5154472247566,10.5318816989674,10.51249788386,10.6840002485408,10.6852697936787,10.6951770841115,10.7407030155785,10.7295920804913,10.7088552426927,10.7097505456305,..,..
World,WLD,Arable land (hectares per person),AG.LND.ARBL.HA.PC,0.219636720681778,0.21639292267953,0.213042999131082,0.211046318618529,0.208935548053904,0.206562361318641,0.203546028627172,0.189245403539329,0.187038050758208,0.185050176379129,0.183712953201238,0.18152066030176,0.179276044390044,0.177494919005969,..,..
World,WLD,Arable land (hectares),AG.LND.ARBL.HA,..,..,..,..,..,..,..,..,..,..,..,..,..,..,..,..
World,WLD,ARI treatment (% of children under 5 taken to a health provider),SH.STA.ARIC.ZS,..,..,..,..,..,..,..,..,..,..,..,..,..,..,..,..
World,WLD,Armed forces personnel (% of total labor force),MS.MIL.TOTL.TF.ZS,1.07360426472114,1.0203267852181,1.00802338172803,0.988747825802592,0.95153745962419,0.972387249048009,0.966163622391754,0.83688870469127,0.833004744979717,0.828534465221294,0.817603282235958,0.817339084239896,0.803633032825742,..,..,..
World,WLD,"Armed forces personnel, total",MS.MIL.TOTL.P1,29353100,28211700,28306950,28161400,27081142,28539442,27029682,27309630,27437280,27542350,27414000,27645315,27671000,..,..,..
World,WLD,Arms exports (SIPRI trend indicator values),MS.MIL.XPRT.KD,..,..,..,..,..,..,..,..,..,..,..,..,..,..,..,..
World,WLD,Arms imports (SIPRI trend indicator values),MS.MIL.MPRT.KD,19248000000,18434000000,17782000000,18932000000,21325000000,20898000000,24560000000,26983000000,28585000000,31371000000,31694000000,26967000000,26933000000,22400000000,..,..
World,WLD,"Automated teller machines (ATMs) (per 100,000 adults)",FB.ATM.TOTL.P5,..,..,..,..,18.2905537295579,16.0617499506938,19.2518402186211,35.3336350043347,36.1991631194219,37.0816783782248,37.744843520514,38.2109850615232,40.7299340025649,41.2398674491432,39.6914655909565,..
World,WLD,Average precipitation in depth (mm per year),AG.LND.PRCP.MM,..,..,..,..,..,..,..,..,..,..,..,..,..,..,..,..
World,WLD,Average time to clear exports through customs (days),IC.CUS.DURS.EX,..,..,..,..,..,..,..,..,..,..,..,..,..,..,7.32894736842105,..
World,WLD,Average transaction cost of sending remittances from a specific country (%),SI.RMT.COST.OB.ZS,..,..,..,..,..,..,..,..,..,..,..,..,..,..,..,..
World,WLD,Average transaction cost of sending remittances to a specific country (%),SI.RMT.COST.IB.ZS,..,..,..,..,..,..,..,..,..,..,..,..,..,..,..,..
World,WLD,"Average working hours of children, study and work, ages 7-14 (hours per week)",SL.TLF.0714.SW.TM,..,..,..,..,..,..,..,..,..,..,..,..,..,..,..,..
World,WLD,"Average working hours of children, study and work, female, ages 7-14 (hours per week)",SL.TLF.0714.SW.FE.TM,..,..,..,..,..,..,..,..,..,..,..,..,..,..,..,..
World,WLD,"Average working hours of children, study and work, male, ages 7-14 (hours per week)",SL.TLF.0714.SW.MA.TM,..,..,..,..,..,..,..,..,..,..,..,..,..,..,..,..
World,WLD,"Average working hours of children, working only, ages 7-14 (hours per week)",SL.TLF.0714.WK.TM,..,..,..,..,..,..,..,..,..,..,..,..,..,..,..,..
